{
  "verzija_sheme": 1,
  "id": "bio-sad/naslovnica-2026-10",
  "modul": "redesign",
  "stranka": {
    "slug": "bio-sad",
    "naziv": "BIO-SAD d.o.o.",
    "url": "https://www.bio-sad.si/sl/",
    "crm_id": "sheets:5386683000"
  },
  "ustvarjeno": "2026-10-11T04:27:37+00:00",
  "faze": [
    {
      "id": "F0",
      "ime": "Inventar",
      "stanje": "zakljuceno",
      "posodobljeno": "2026-10-11T04:30:14+00:00",
      "izhodi": [],
      "opomba": "Ponovno uporabljeno: 29 originalnih slik (prej materiali/), 79 strani iz predpomnilnika, 206 meritev slik. Manjkalo: raziskava, besedila, poziv."
    },
    {
      "id": "F1",
      "ime": "Pregled strani",
      "stanje": "zakljuceno",
      "posodobljeno": "2026-10-11T04:30:14+00:00",
      "izhodi": [
        "01_analiza/analiza.md",
        "01_analiza/brand.json",
        "01_analiza/pages.json",
        "01_analiza/posnetki/obstojeca-1440.jpg",
        "01_analiza/posnetki/obstojeca-390.jpg",
        "01_analiza/slike.tsv"
      ],
      "opomba": ""
    },
    {
      "id": "F2",
      "ime": "Raziskava",
      "stanje": "zakljuceno",
      "posodobljeno": "2026-10-11T04:36:53+00:00",
      "izhodi": [
        "01_analiza/dejstva.md"
      ],
      "opomba": "IFS Food Higher Level 98,04 % (do 19. 11. 2026), ISO 9001 do 2029, 11 medalj. Odprto: aktualnost podatkov 2019, pravna skladnost oglaševanja alkohola."
    },
    {
      "id": "F3",
      "ime": "Vsebina",
      "stanje": "zakljuceno",
      "posodobljeno": "2026-10-11T04:40:47+00:00",
      "izhodi": [
        "02_vsebina/besedila.md",
        "02_vsebina/seo-geo.md",
        "02_vsebina/struktura.md"
      ],
      "opomba": ""
    },
    {
      "id": "F4",
      "ime": "Vizualni materiali",
      "stanje": "zakljuceno",
      "posodobljeno": "2026-10-11T04:43:11+00:00",
      "izhodi": [
        "03_paket-chatgpt/EVIDENCA.md",
        "03_paket-chatgpt/barve.md",
        "03_paket-chatgpt/izbor.tsv",
        "03_paket-chatgpt/slike.json"
      ],
      "opomba": "29/29 slik ponovno uporabljenih, 0 prenesenih."
    },
    {
      "id": "F5",
      "ime": "Paket za ChatGPT",
      "stanje": "zakljuceno",
      "posodobljeno": "2026-10-11T04:43:11+00:00",
      "izhodi": [
        "03_paket-chatgpt/chatgpt-poziv.md",
        "03_paket-chatgpt/smernice.md"
      ],
      "opomba": "ZIP bio-sad-chatgpt.zip (7,6 MB) – čaka V1."
    },
    {
      "id": "F6",
      "ime": "Gradnja",
      "stanje": "caka",
      "posodobljeno": null,
      "izhodi": [],
      "opomba": ""
    },
    {
      "id": "F7",
      "ime": "Predogled",
      "stanje": "caka",
      "posodobljeno": null,
      "izhodi": [],
      "opomba": ""
    },
    {
      "id": "F8",
      "ime": "Prodaja",
      "stanje": "caka",
      "posodobljeno": null,
      "izhodi": [],
      "opomba": ""
    }
  ],
  "odobritve": [],
  "predogled": {
    "pot": null,
    "url": null,
    "objavljeno": null
  },
  "posodobljeno": "2026-10-11T05:10:51+00:00"
}
